{
  "$schema": "https://json-schema.org/draft/2020-12/schema",
  "$id": "https://wemove.com/schemas/ingrid/schemes/dataCollectionBase",
  "type": "object",
  "definitions": {
    "propertiesDataCollection": {
      "type": "object",
      "properties": {
        "isOpenData": {
          "type": ["null", "boolean"]
        }
      }
    }
  },
  "properties": {
    "properties": {
      "$ref": "#/definitions/propertiesDataCollection"
    },
    "_uuid": {
      "type": "string"
    },
    "_type": {
      "const": "InGridDataCollection"
    },
    "title": {
      "type": "string"
    },
    "description": {
      "type": "string"
    },
    "alternateTitle": {
      "type": ["null", "string"]
    },
    "parentIdentifier": {
      "type": ["null", "string"]
    },
    "pointOfContact": {
      "type": "array",
      "items": {
        "$ref": "../../general.schema.json#/definitions/PointOfContact"
      },
      "minItems": 1
    },
    "publication": {
      "type": "object",
      "additionalProperties": false,
      "properties": {
        "doi": {
          "type": ["null", "string"]
        },
        "generalResourceType": {
          "anyOf": [
            {
              "$ref": "../../general.schema.json#/definitions/KeyValue"
            },
            {
              "type": "null"
            }
          ]
        },
        "resourceType": {
          "anyOf": [
            {
              "$ref": "../../general.schema.json#/definitions/KeyValue"
            },
            {
              "type": "null"
            }
          ]
        }
      }
    },
    "advProductGroups": {
      "$ref": "refs/general.schema.json#/definitions/advProductGroups"
    },
    "themes": {
      "$ref": "refs/general.schema.json#/definitions/themes"
    },
    "spatial": {
      "$ref": "refs/general.schema.json#/definitions/Spatial"
    },
    "temporal": {
      "$ref": "refs/general.schema.json#/definitions/temporal"
    },
    "dataset": {
      "$ref": "refs/general.schema.json#/definitions/dataset"
    },
    "extraInfo": {
      "$ref": "refs/general.schema.json#/definitions/extraInfo"
    },
    "metadata": {
      "$ref": "refs/general.schema.json#/definitions/metadata"
    },
    "resource": {
      "$ref": "refs/general.schema.json#/definitions/resource"
    },
    "keywords": {
      "$ref": "refs/general.schema.json#/definitions/keywords"
    },
    "maintenanceInformation": {
      "$ref": "refs/general.schema.json#/definitions/maintenanceInformation"
    },
    "references": {
      "$ref": "refs/general.schema.json#/definitions/references"
    },
    "graphicOverviews": {
      "$ref": "refs/general.schema.json#/definitions/graphicOverviews"
    },
    "digitalTransferOptions": {
      "$ref": "refs/general.schema.json#/definitions/digitalTransferOptions"
    },
    "categoryCatalog": {
      "$ref": "refs/general.schema.json#/definitions/categoryCatalog"
    },
    "distribution": {
      "$ref": "refs/general.schema.json#/definitions/distribution"
    },
    "databaseContent": {
      "$ref": "refs/general.schema.json#/definitions/databaseContent"
    },
    "explanation": {
      "$ref": "refs/general.schema.json#/definitions/explanation"
    },
    "methodText": {
      "$ref": "refs/general.schema.json#/definitions/methodText"
    },
    "orderInfo": {
      "$ref": "refs/general.schema.json#/definitions/orderInfo"
    },
    "openDataCategories": {
      "type": "array",
      "items": {
        "$ref": "../../general.schema.json#/definitions/KeyValue"
      }
    },
    "fileReferences": {
      "type": "array",
      "items": {
        "$ref": "../../general.schema.json#/definitions/FileReference"
      }
    }
  },
  "required": [
    "_uuid",
    "_type",
    "title",
    "description",
    "pointOfContact",
    "spatial",
    "temporal",
    "metadata",
    "dataset"
  ],
  "title": "DataCollection"
}
