{
  "_uuid": "a0d1ad6d-4237-4b6e-b0be-cfd072510531",
  "_type": "InGridDataCollection",
  "title": "abab",
  "dataset": { "languages": ["123"] },
  "spatial": {
    "references": [
      {
        "type": "free",
        "title": "Lederhose, Münchenbernsdorf, Greiz, Thüringen, Deutschland (administrative)",
        "value": {
          "lat1": 50.7910776,
          "lat2": 50.8084996,
          "lon1": 11.8930983,
          "lon2": 11.941834
        }
      }
    ],
    "description": "jhgf",
    "spatialSystems": [{ "key": "9000001" }],
    "verticalExtent": {
      "spatialSystem": { "key": "900005" },
      "maximumValue": 43,
      "minimumValue": 234,
      "unitOfMeasure": { "key": "9001" }
    }
  },
  "keywords": {
    "free": []
  },
  "metadata": { "language": { "key": "65" } },
  "resource": {
    "purpose": "purpose",
    "specificUsage": "use",
    "useLimitation": "constraints",
    "useConstraints": [{ "title": { "key": "18" }, "source": "q" }],
    "accessConstraints": [{ "key": "6" }]
  },
  "temporal": {
    "event": {
      "lastModified": "2023-02-06T23:00:00.000Z"
    },
    "status": { "key": "5" },
    "data": {
      "type": "range",
      "intervalFrom": "not-available",
      "intervalTo": "date",
      "resourceDate": "2023-02-21T23:00:00.000Z"
    }
  },
  "extraInfo": { "legalBasicsDescriptions": [{ "key": "60" }] },
  "orderInfo": "order",
  "methodText": "ghjk",
  "references": [
    {
      "url": "https://this.url.ag",
      "referenceType": "url",
      "type": { "key": "3570" },
      "title": "basis",
      "explanation": "blabla"
    }
  ],
  "description": "asdf",
  "explanation": "ghjk",
  "distribution": {},
  "alternateTitle": "fdsa",
  "pointOfContact": [
    { "ref": "36ec9150-2f1b-4164-8221-08f9a85fc4fb", "type": { "key": "10" } }
  ],
  "categoryCatalog": [
    {
      "date": "2023-02-08T23:00:00.000Z",
      "title": { "key": "1" },
      "edition": "asd"
    }
  ],
  "databaseContent": [{ "moreInfo": "sdfg", "parameter": "rewq" }],
  "advProductGroups": [{ "key": "2" }],
  "graphicOverviews": [
    {
      "fileName": {
        "uri": "https://cpyresss.com/rubbish",
        "value": "https://cpyresss.com/rubbish",
        "asLink": true
      },
      "fileDescription": "asdf"
    }
  ],
  "parentIdentifier": "ident",
  "digitalTransferOptions": [
    {
      "name": { "key": "1" },
      "mediumNote": "location",
      "transferSize": { "value": 50, "unit": { "key": "MB" } }
    }
  ],
  "maintenanceInformation": {
    "description": "information",
    "maintenanceAndUpdateFrequency": { "key": "8" },
    "userDefinedMaintenanceFrequency": { "unit": { "key": "5" }, "number": 4 }
  },
  "publication": {
    "doi": "10.1000/1234",
    "generalResourceType": { "key": "5" },
    "resourceType": { "key": "2" }
  }
}
